Intrebare,Raspuns1,Raspuns2,Raspuns3,IndiceCorect
What is the primary purpose of licensing in the context of digital content?,Generate revenue for content creators,Provide legal permission to use digital content,Regulate the distribution of digital content,2
What is a licensee in the context of licensing agreements?,The party granted permission to use the intellectual property,The creator of the digital content,The legal document outlining the terms of use,1
Can you freely use software if you gain access to its source code?,"No, the product already exists on the market","Yes, because it means that it was not a secret information","No, the agreement usually contains terms on this scenario",3
What license grants exclusive ownership of creative works?,Copyright licensing,Exclusive licence,Trademark licensing,1
What does a termination clause in a licensing agreement specify?,The obligations of both licensor and licensee,The conditions for ending the licensing agreement,The duration of the license,2
How do licensing agreements benefit businesses?,Enabling them to leverage their IP for revenue,Limiting their intellectual property rights,Reducing the need for licensing agreements,1
How can licensees affect a company's reputation?,Reputation damage is reversible,Negative feedback from clients is unavoidable,Clear standards and monitoring methods must be implemented,3
What is the primary purpose of patent licensing?,Grant exclusive rights over creative works,Share patented creations for mass production and distribution,Allow licensees to use brand logos and slogans,2
What is a licence?,"Official permission to do, use, or own something, or its document",A digital content vendor,Trade secret information,1
Why is it important to be aware of licence agreements and respect them?,Respecting the agreements provides you a competitive edge,"None of the above, licence agreements are not relevant",To avoid legal consequences &respect intellectual property rights,3
How does the nr of licensors and licensees impact licensing arrangements?,It reduces the need for comprehensive paperwork,It affects negotiating tactics and the property rights,It simplifies the negotiation process,2
"What does the term royalties refer to, in licensing area?",Penalties imposed for copyright infringements,Financial rewards given to employees for their performance,Payments made for the right to use intellectual property,3
What advantage does a licensing agreement offer?,Access to new markets&authority over intellectual capital,Reduction of administrative tasks,Increased competition in the market,1
What does the term licensor refer to?,The party granting the licence,A type of licensing fee,A legal requirement for licensing agreements,1
What type of licence grants exclusive rights over the intellectual property?,Open licence,Trademark licence,Exclusive licence,3
What role does comprehensive paperwork play in licensing agreements?,It increases manufacturing costs,It outlines the terms of the agreement,It simplifies the negotiation process,2
How do smart contracts contribute to reducing risks in transaction?,By eliminating trusted intermediaries,Through automating contract execution,Using encryption for sensitive data,2
What's a key challenge of using blockchain and smart contracts in licensing?,Legal and regulatory framework,Stream lining the process of looking up licenses,Encryption of sensitive data,1
What does the term fixed data in blockchain technology refer to?,Maintaining an irreversible record of intellectual property licenses,Preventing unauthorized access to data,Creating a sequential chain of blocks,1
What is the objective of smart contracts?,Decreasing fraud risks& reducing arbitration costs,Minimizing reliance on trusted intermediarie,All answers,3
What is the method of validating and attaching new transaction blocks?,Through consensus method protocol,By individual users,By centralized authorities,1
What components are included in each block of a blockchain?,Transaction data and previous block's hash,Transaction data and timestamp,Timestamp and transaction data only,1
